start_date,end_date,country,query,clicks,impressions,ctr,position
2024-05-01,2024-05-07,chl,los algodones dental care,0,1,0,66
2024-05-08,2024-05-14,chl,dental veneers los algodones,0,1,0,85
2024-05-15,2024-05-21,chl,hygiene inside los algodones dental clinic,0,1,0,48
2024-05-22,2024-05-28,chl,dentists in mexico near yuma,0,1,0,57
2024-05-29,2024-06-04,chl,yuma mexico dentist,0,1,0,93
2024-06-05,2024-06-11,chl,mexico dentist near yuma,0,1,0,82
2024-06-05,2024-06-11,chl,yuma mexico dentist,0,1,0,81
