start_date,end_date,country,query,clicks,impressions,ctr,position
2024-05-01,2024-05-07,mex,how much is a full set of dental implants in mexico,0,1,0,80
2024-05-01,2024-05-07,mex,mexican dental work prices,0,1,0,85
2024-05-08,2024-05-14,mex,dental cost mexico,0,1,0,87
2024-05-15,2024-05-21,mex,cost of dental work in mexico,0,1,0,69
2024-05-15,2024-05-21,mex,dental work in mexico cost,0,1,0,52
2024-05-15,2024-05-21,mex,how much does a crown cost in mexico,0,1,0,94
2024-05-15,2024-05-21,mex,how much does dental work cost in mexico,0,2,0,66
2024-05-15,2024-05-21,mex,prices for dental work in mexico,0,1,0,59
2024-05-22,2024-05-28,mex,all on 6 dental implants mexico,0,1,0,82
